{
  "$schema": "https://json-schema.org/draft/2020-12/schema",
  "title": "Fixed-IP router profile v1 candidate",
  "type": "object",
  "additionalProperties": false,
  "required": ["schema_version", "profile_id", "revision", "status", "logical_target", "tls_sni", "http_host", "certificate_name", "ip_set", "nodes", "source_evidence_refs", "validation_evidence_refs", "supersedes"],
  "properties": {
    "schema_version": {"const": "fixed-ip-router-profile-v1"},
    "profile_id": {"type": "string", "minLength": 1},
    "revision": {"type": "integer", "minimum": 1},
    "status": {"enum": ["DOCUMENTED_CURRENT_MEASURED_SET", "CANDIDATE", "ADMITTED", "STALE", "SUPERSEDED"]},
    "logical_target": {"const": "chatgpt.com"},
    "tls_sni": {"const": "chatgpt.com"},
    "http_host": {"const": "chatgpt.com"},
    "certificate_name": {"const": "chatgpt.com"},
    "ip_set": {"type": "array", "minItems": 2, "maxItems": 2, "uniqueItems": true, "items": {"type": "string", "format": "ipv4"}},
    "nodes": {
      "type": "array", "minItems": 3, "maxItems": 3,
      "prefixItems": [
        {"const": {"name": "burzh", "host_identity": "ruvds-xnqc6"}},
        {"const": {"name": "mazhor", "host_identity": "p552203.kvmvps"}},
        {"const": {"name": "erefia", "host_identity": "ruvds-ygo0w"}}
      ],
      "items": false
    },
    "source_evidence_refs": {"type": "array", "minItems": 1, "items": {"type": "string", "minLength": 1}},
    "validation_evidence_refs": {"type": "array", "minItems": 1, "items": {"type": "string", "minLength": 1}},
    "supersedes": {"type": ["string", "null"]}
  }
}
